Full Name,Email,Preferred Language,Department,Job Title,Location,Years of Experience,Competencies,Personality,Availability,Max Mentees,Why do you want to mentor
Olusegun Bakare,olusegun.bakare@dangote.com,English,Refinery,General Manager,Lagos,18,"Leadership, Strategic Thinking, Process Engineering",Driver,Weekday evenings,3,Giving back to the next generation of engineers
Mariama Sall,mariama.sall@dangote.com,Français,Logistics,Directrice Adjointe,Dakar,14,"Communication, Supply Chain Optimization, Stakeholder Management",Amiable,Vendredis après-midi,2,Développer les talents francophones du groupe
Henry Okolie,henry.okolie@dangote.com,English,Finance,Senior Finance Manager,Abuja,11,"Financial Analysis, Decision Making",Analytical,Tuesday mornings,2,Coaching young analysts gives me energy
Awa Cissé,awa.cisse@dangote.com,French,Cement,Chef de Production,Douala,9,"Quality Control, Team Building",Expressive,Lundis,2,Partager mon expérience industrielle
Daniel Adewale,daniel.adewale(at)dangote.com,English,IT,Solutions Architect,Lagos,12,"Data Analytics, Project Management",Analytical,Flexible,2,Mentoring is how I learned — paying it forward
Comfort Nnaji,,English,Sugar,Operations Lead,Kano,16,"Leadership, Safety & HSE",Driver,Weekends,3,Building safer operations through people
Ibrahima Diop,ibrahima.diop@dangote.com,,Fertilizer,Ingénieur Principal,Abidjan,20,,Analytical,Jeudis,2,Transmettre vingt ans de terrain
Olusegun Bakare,olusegun.bakare@dangote.com,English,Refinery,General Manager,Lagos,18,"Leadership, Strategic Thinking",Driver,Weekday evenings,3,Duplicate row from a copy-paste mistake
